{
  "holdout": {
    "seed": "seed-play_tea_ds04_v1",
    "fraction": 0.1,
    "min_treated_n": 20
  },
  "expected_outcome": {
    "units": 27.64,
    "margin_inr": 9191.29,
    "waste_avoided_inr": 9397.29,
    "discount_cost_inr": 0.0,
    "ci_low": 1.49,
    "ci_high": 80.63,
    "prior_n": 20.0,
    "measured_n": 0,
    "estimator_version": "est-v1"
  },
  "guardrails": [
    {
      "rule": "margin_floor",
      "passed": true,
      "detail": "net margin 24.44% (net price 450.00, cost 340.00) vs premium_tea floor 12.00%"
    },
    {
      "rule": "frequency_cap",
      "passed": true,
      "detail": "all 394 customers under 2 plays in 7 days"
    },
    {
      "rule": "consent_required",
      "passed": true,
      "detail": "audience filtered by consent: 468 -> 394"
    },
    {
      "rule": "sellby_disclosure",
      "passed": true,
      "detail": "copy pending; best-before disclosure enforced at copy validation"
    },
    {
      "rule": "subscription_protect",
      "passed": true,
      "detail": "transfer_plus_nudge is not a discount play"
    },
    {
      "rule": "no_cannibalise_stockout",
      "passed": true,
      "detail": "transfer_plus_nudge does not push SKU-DARJEELING-TEA-100G; stockout rule not applicable"
    },
    {
      "rule": "holdout_required",
      "passed": true,
      "detail": "holdout 10%, min_treated_n 20"
    },
    {
      "rule": "cite_or_drop",
      "passed": true,
      "detail": "4 number(s) in rationale all cited; 4 citation(s) resolve"
    }
  ],
  "target": {
    "deadline_date": "2026-10-06",
    "sku": "SKU-DARJEELING-TEA-100G",
    "node_ids": [
      "DS-04"
    ],
    "batch_ids": [
      "B-TEA-DS04-01"
    ],
    "units": 103,
    "deadline_type": "online_sellby"
  },
  "window": {
    "end": "2026-10-06T23:59:59Z",
    "start": "2026-09-12T00:00:00Z"
  },
  "channel": "web_chat",
  "mechanic_params": {
    "transfer_units": 103,
    "transfer_to_node": "OUT-01"
  },
  "citations": [
    {
      "type": "gap",
      "ref": "gap_tea_ds04"
    },
    {
      "ref": "est-v1",
      "type": "estimator"
    },
    {
      "type": "policy",
      "ref": "v1"
    },
    {
      "type": "forecast",
      "ref": "sense_20260912_baseline_2aaad73c"
    }
  ],
  "alternatives": [
    {
      "mechanic": "bundle",
      "mechanic_params": {
        "bundle_sku": "SKU-SOAN-PAPDI-1KG",
        "bundle_price": 740
      },
      "expected_units": 27.64,
      "expected_margin_inr": 1234.36,
      "rejected_because": "The policy prefers transfers for premium tea, and the transfer play yields a higher expected margin of 9191.29 INR compared to 1234.36 INR for the bundle."
    },
    {
      "mechanic": "coupon",
      "rejected_because": "The policy prefers transfers for premium tea, and the transfer play yields a higher expected margin of 9191.29 INR compared to 1796.54 INR for the coupon.",
      "expected_units": 27.64,
      "mechanic_params": {
        "discount_pct": 10
      },
      "expected_margin_inr": 1796.54
    }
  ],
  "mechanic": "transfer_plus_nudge",
  "audience": {
    "size_before_consent": 468,
    "segment_ids": [
      "seg_2",
      "seg_1",
      "seg_3",
      "seg_5",
      "seg_6"
    ],
    "filters": {},
    "purpose": "marketing",
    "size_after_consent": 394
  },
  "objective": "clear_online_sellby",
  "rationale": "This play transfers 103 units of premium tea to OUT-01 to clear the online sell-by risk. The transfer play recovers 9191.29 INR compared to doing nothing, and beats a blanket markdown by 6186.47 INR. It targets high-affinity segments with 394 reachable customers. This aligns with the policy preference for transfers over markdowns for premium tea.",
  "play_id": "play_tea_ds04_v1",
  "counterfactuals": {
    "do_nothing_inr": 35020.0,
    "blanket_markdown_inr": 32015.18,
    "blanket_markdown_pct": 20.0,
    "play_net_inr": -25828.71
  },
  "gap_id": "gap_tea_ds04",
  "copy": {
    "variants": [],
    "copy_status": "pending",
    "language_set": [
      "en"
    ]
  },
  "created_at": "2026-09-12T03:30:00Z",
  "status": "proposed",
  "policy_version": "v1",
  "trace_ref": "events/run_tea_ds04_v1_e6b5d8f9",
  "cost": {
    "plan_cost_inr": 3.94,
    "conversation_budget_inr": 51.22,
    "pct_of_rupees_at_stake": 0.158
  },
  "source": "live_gemini"
}
