{
  "target": {
    "deadline_date": "2026-10-06",
    "units": 103,
    "deadline_type": "online_sellby",
    "node_ids": [
      "DS-04"
    ],
    "sku": "SKU-DARJEELING-TEA-100G",
    "batch_ids": [
      "B-TEA-DS04-01"
    ]
  },
  "alternatives": [
    {
      "expected_units": 27.64,
      "mechanic_params": {
        "transfer_units": 103,
        "transfer_to_node": "OUT-02"
      },
      "rejected_because": "OUT-01 is preferred as the primary transfer candidate",
      "expected_margin_inr": 9191.29,
      "mechanic": "transfer_plus_nudge"
    }
  ],
  "guardrails": [
    {
      "rule": "margin_floor",
      "passed": true,
      "detail": "net margin 24.44% (net price 450.00, cost 340.00) vs premium_tea floor 12.00%"
    },
    {
      "rule": "frequency_cap",
      "passed": true,
      "detail": "all 394 customers under 2 plays in 7 days"
    },
    {
      "rule": "consent_required",
      "passed": true,
      "detail": "audience filtered by consent: 468 -> 394"
    },
    {
      "rule": "sellby_disclosure",
      "passed": true,
      "detail": "copy pending; best-before disclosure enforced at copy validation"
    },
    {
      "rule": "subscription_protect",
      "passed": true,
      "detail": "transfer_plus_nudge is not a discount play"
    },
    {
      "rule": "no_cannibalise_stockout",
      "passed": true,
      "detail": "transfer_plus_nudge does not push SKU-DARJEELING-TEA-100G; stockout rule not applicable"
    },
    {
      "rule": "holdout_required",
      "passed": true,
      "detail": "holdout 10%, min_treated_n 20"
    },
    {
      "rule": "cite_or_drop",
      "passed": true,
      "detail": "0 number(s) in rationale all cited; 4 citation(s) resolve"
    }
  ],
  "holdout": {
    "seed": "seed-play_tea_ds04_v1",
    "min_treated_n": 20,
    "fraction": 0.1
  },
  "gap_id": "gap_tea_ds04",
  "copy": {
    "language_set": [
      "en"
    ],
    "copy_status": "pending",
    "variants": []
  },
  "counterfactuals": {
    "do_nothing_inr": 35020.0,
    "blanket_markdown_inr": 32015.18,
    "blanket_markdown_pct": 20.0,
    "play_net_inr": -25828.71
  },
  "play_id": "play_tea_ds04_v1",
  "rationale": "This play transfers the at-risk units of Darjeeling Tea from the dark store to the outlet to clear the online sell-by breach. It targets high-affinity segments after consent. The play is expected to sell a portion of the units, generating positive margin and avoiding waste. This transfer-based approach is preferred over blanket markdowns under the policy.",
  "mechanic": "transfer_plus_nudge",
  "expected_outcome": {
    "units": 27.64,
    "margin_inr": 9191.29,
    "waste_avoided_inr": 9397.29,
    "discount_cost_inr": 0.0,
    "ci_low": 1.49,
    "ci_high": 80.63,
    "prior_n": 20.0,
    "measured_n": 0,
    "estimator_version": "est-v1"
  },
  "channel": "web_chat",
  "objective": "clear_online_sellby",
  "citations": [
    {
      "type": "gap",
      "ref": "gap_tea_ds04"
    },
    {
      "ref": "est-v1",
      "type": "estimator"
    },
    {
      "ref": "v1",
      "type": "policy"
    },
    {
      "type": "forecast",
      "ref": "sense_20260912_baseline_2aaad73c"
    }
  ],
  "audience": {
    "purpose": "marketing",
    "segment_ids": [
      "seg_2",
      "seg_1",
      "seg_3",
      "seg_5",
      "seg_6"
    ],
    "size_before_consent": 468,
    "size_after_consent": 394,
    "filters": {}
  },
  "window": {
    "end": "2026-10-06T23:59:59Z",
    "start": "2026-09-12T00:00:00Z"
  },
  "mechanic_params": {
    "transfer_units": 103,
    "transfer_to_node": "OUT-01"
  },
  "created_at": "2026-09-12T03:30:00Z",
  "status": "proposed",
  "policy_version": "v1",
  "trace_ref": "events/run_tea_ds04_v1_e6b5d8f9",
  "cost": {
    "plan_cost_inr": 3.94,
    "conversation_budget_inr": 51.22,
    "pct_of_rupees_at_stake": 0.158
  },
  "source": "live_gemini"
}
