{
  "holdout": {
    "fraction": 0.1,
    "min_treated_n": 20,
    "seed": "seed-play_chips_ds07_v1"
  },
  "alternatives": [
    {
      "expected_units": 24.36,
      "expected_margin_inr": -127.12,
      "rejected_because": "negative expected margin due to transfer costs",
      "mechanic": "transfer_plus_nudge",
      "mechanic_params": {
        "transfer_units": 368,
        "transfer_to_node": "OUT-03"
      }
    }
  ],
  "gap_id": "gap_chips_ds07",
  "mechanic": "outlet_markdown",
  "counterfactuals": {
    "do_nothing_inr": 9200.0,
    "blanket_markdown_inr": 8947.19,
    "blanket_markdown_pct": 5.0,
    "play_net_inr": -8509.8
  },
  "play_id": "play_chips_ds07_v1",
  "copy": {
    "variants": [],
    "copy_status": "pending",
    "language_set": [
      "en"
    ]
  },
  "target": {
    "deadline_date": "2026-09-18",
    "units": 368,
    "batch_ids": [
      "B-CHIPS-DS07-01"
    ],
    "sku": "SKU-MASALA-CHIPS-200G",
    "deadline_type": "online_sellby",
    "node_ids": [
      "DS-07"
    ]
  },
  "guardrails": [
    {
      "rule": "margin_floor",
      "passed": true,
      "detail": "net margin 12.28% (net price 28.50, cost 25.00) vs snacks floor 8.00%"
    },
    {
      "rule": "frequency_cap",
      "passed": true,
      "detail": "all 352 customers under 2 plays in 7 days"
    },
    {
      "rule": "consent_required",
      "passed": true,
      "detail": "outlet channel: no personal message, consent not required"
    },
    {
      "rule": "sellby_disclosure",
      "passed": true,
      "detail": "copy pending; best-before disclosure enforced at copy validation"
    },
    {
      "rule": "subscription_protect",
      "passed": true,
      "detail": "no active subscribers of SKU-MASALA-CHIPS-200G in audience"
    },
    {
      "rule": "no_cannibalise_stockout",
      "passed": true,
      "detail": "no stockout gap for SKU-MASALA-CHIPS-200G at DS-07"
    },
    {
      "rule": "holdout_required",
      "passed": true,
      "detail": "holdout 10%, min_treated_n 20"
    },
    {
      "rule": "cite_or_drop",
      "passed": true,
      "detail": "0 number(s) in rationale all cited; 4 citation(s) resolve"
    }
  ],
  "expected_outcome": {
    "units": 24.22,
    "margin_inr": 84.76,
    "waste_avoided_inr": 605.44,
    "discount_cost_inr": 36.33,
    "ci_low": 1.31,
    "ci_high": 70.65,
    "prior_n": 20.0,
    "measured_n": 0,
    "estimator_version": "est-v1"
  },
  "rationale": "We propose an outlet markdown play to clear the online sell-by breach gap. This play targets all high-affinity segments at the outlet channel. The alternative transfer play was rejected due to negative expected margin.",
  "objective": "clear_online_sellby",
  "audience": {
    "size_before_consent": 426,
    "size_after_consent": 352,
    "purpose": "marketing",
    "segment_ids": [
      "seg_5",
      "seg_2",
      "seg_1",
      "seg_3",
      "seg_4",
      "seg_6"
    ],
    "filters": {}
  },
  "channel": "outlet",
  "citations": [
    {
      "type": "gap",
      "ref": "gap_chips_ds07"
    },
    {
      "type": "estimator",
      "ref": "est-v1"
    },
    {
      "type": "policy",
      "ref": "v1"
    },
    {
      "ref": "sense_20260912_baseline_2aaad73c",
      "type": "forecast"
    }
  ],
  "mechanic_params": {
    "markdown_pct": 5
  },
  "window": {
    "start": "2026-09-12T00:00:00Z",
    "end": "2026-09-18T23:59:59Z"
  },
  "created_at": "2026-09-12T03:30:00Z",
  "status": "proposed",
  "policy_version": "v1",
  "trace_ref": "events/run_chips_ds07_v1_71596554",
  "cost": {
    "plan_cost_inr": 3.94,
    "conversation_budget_inr": 45.76,
    "pct_of_rupees_at_stake": 0.54
  },
  "source": "live_gemini"
}
