{
  "mechanic": "transfer_plus_nudge",
  "mechanic_params": {
    "transfer_to_node": "OUT-01",
    "transfer_units": 103
  },
  "copy": {
    "copy_status": "pending",
    "language_set": [
      "en"
    ],
    "variants": []
  },
  "gap_id": "gap_tea_ds04",
  "window": {
    "start": "2026-09-12T00:00:00Z",
    "end": "2026-10-06T23:59:59Z"
  },
  "citations": [
    {
      "type": "gap",
      "ref": "gap_tea_ds04"
    },
    {
      "type": "estimator",
      "ref": "est-v1"
    },
    {
      "type": "policy",
      "ref": "v1"
    },
    {
      "type": "forecast",
      "ref": "sense_20260912_baseline_2aaad73c"
    }
  ],
  "audience": {
    "purpose": "marketing",
    "segment_ids": [
      "seg_2",
      "seg_1",
      "seg_3",
      "seg_5",
      "seg_6"
    ],
    "filters": {},
    "size_after_consent": 394,
    "size_before_consent": 468
  },
  "rationale": "This play transfers units of Darjeeling Tea from Dark store to Outlet to clear the online sell-by breach gap. We target high-affinity customer segments with a total size of 394 after consent. The transfer plus nudge mechanic is preferred by policy over markdowns for premium tea. It is expected to clear 27.64 units, avoiding 9397.29 INR in waste.",
  "channel": "web_chat",
  "target": {
    "sku": "SKU-DARJEELING-TEA-100G",
    "units": 103,
    "node_ids": [
      "DS-04"
    ],
    "deadline_date": "2026-10-06",
    "deadline_type": "online_sellby",
    "batch_ids": [
      "B-TEA-DS04-01"
    ]
  },
  "play_id": "play_tea_ds04_v1",
  "expected_outcome": {
    "units": 27.64,
    "margin_inr": 9191.29,
    "waste_avoided_inr": 9397.29,
    "discount_cost_inr": 0.0,
    "ci_low": 1.49,
    "ci_high": 80.63,
    "prior_n": 20.0,
    "measured_n": 0,
    "estimator_version": "est-v1"
  },
  "counterfactuals": {
    "do_nothing_inr": 35020.0,
    "blanket_markdown_inr": 32015.18,
    "blanket_markdown_pct": 20.0,
    "play_net_inr": -25828.71
  },
  "alternatives": [
    {
      "mechanic_params": {
        "bundle_sku": "SKU-SOAN-PAPDI-1KG",
        "bundle_price": 750
      },
      "expected_units": 27.64,
      "expected_margin_inr": 1510.75,
      "rejected_because": "lower expected margin than the transfer play",
      "mechanic": "bundle"
    }
  ],
  "holdout": {
    "min_treated_n": 20,
    "seed": "seed-play_tea_ds04_v1",
    "fraction": 0.1
  },
  "guardrails": [
    {
      "rule": "margin_floor",
      "passed": true,
      "detail": "net margin 24.44% (net price 450.00, cost 340.00) vs premium_tea floor 12.00%"
    },
    {
      "rule": "frequency_cap",
      "passed": true,
      "detail": "all 394 customers under 2 plays in 7 days"
    },
    {
      "rule": "consent_required",
      "passed": true,
      "detail": "audience filtered by consent: 468 -> 394"
    },
    {
      "rule": "sellby_disclosure",
      "passed": true,
      "detail": "copy pending; best-before disclosure enforced at copy validation"
    },
    {
      "rule": "subscription_protect",
      "passed": true,
      "detail": "transfer_plus_nudge is not a discount play"
    },
    {
      "rule": "no_cannibalise_stockout",
      "passed": true,
      "detail": "transfer_plus_nudge does not push SKU-DARJEELING-TEA-100G; stockout rule not applicable"
    },
    {
      "rule": "holdout_required",
      "passed": true,
      "detail": "holdout 10%, min_treated_n 20"
    },
    {
      "rule": "cite_or_drop",
      "passed": true,
      "detail": "3 number(s) in rationale all cited; 4 citation(s) resolve"
    }
  ],
  "objective": "clear_online_sellby",
  "created_at": "2026-09-12T03:30:00Z",
  "status": "proposed",
  "policy_version": "v1",
  "trace_ref": "events/run_tea_ds04_v1_ba376cf1",
  "cost": {
    "plan_cost_inr": 3.94,
    "conversation_budget_inr": 51.22,
    "pct_of_rupees_at_stake": 0.158
  },
  "source": "live_gemini"
}
