{
  "channel": "web_chat",
  "objective": "clear_online_sellby",
  "target": {
    "batch_ids": [
      "B-TEA-DS04-01"
    ],
    "deadline_date": "2026-10-06",
    "units": 103,
    "sku": "SKU-DARJEELING-TEA-100G",
    "deadline_type": "online_sellby",
    "node_ids": [
      "DS-04"
    ]
  },
  "alternatives": [
    {
      "mechanic": "bundle",
      "rejected_because": "Lower expected margin than transfer play",
      "expected_margin_inr": 2226.05,
      "expected_units": 27.64,
      "mechanic_params": {
        "bundle_price": 480,
        "bundle_sku": "SKU-WHEAT-BREAD-400G"
      }
    },
    {
      "mechanic_params": {
        "markdown_pct": 15
      },
      "expected_units": 27.64,
      "rejected_because": "Lower expected margin and policy prefers transfers over markdowns",
      "mechanic": "outlet_markdown",
      "expected_margin_inr": 1174.66
    }
  ],
  "mechanic": "transfer_plus_nudge",
  "rationale": "To address the online sell-by breach of Darjeeling Tea 100G at Dark store 04, we propose a transfer of 103 units to Outlet 01 combined with a web chat nudge targeting high-affinity segments. This play is expected to clear 27.64 units, yielding a margin of 9191.29 INR and avoiding 9397.29 INR in waste. The net outcome of -25828.71 INR represents a recovery of 9191.29 INR over doing nothing (35020 INR) and a beat of 6186.47 INR over a blanket markdown (32015.18 INR). This transfer-first approach aligns with the policy's preference for transfers over markdowns for premium tea.",
  "audience": {
    "size_before_consent": 468,
    "size_after_consent": 394,
    "segment_ids": [
      "seg_2",
      "seg_1",
      "seg_3",
      "seg_5",
      "seg_6"
    ],
    "purpose": "marketing",
    "filters": {}
  },
  "expected_outcome": {
    "units": 27.64,
    "margin_inr": 9191.29,
    "waste_avoided_inr": 9397.29,
    "discount_cost_inr": 0.0,
    "ci_low": 1.49,
    "ci_high": 80.63,
    "prior_n": 20.0,
    "measured_n": 0,
    "estimator_version": "est-v1"
  },
  "holdout": {
    "fraction": 0.1,
    "seed": "seed-play_tea_ds04_v1",
    "min_treated_n": 20
  },
  "mechanic_params": {
    "transfer_units": 103,
    "transfer_to_node": "OUT-01"
  },
  "copy": {
    "variants": [],
    "language_set": [
      "en"
    ],
    "copy_status": "pending"
  },
  "window": {
    "start": "2026-09-12T00:00:00Z",
    "end": "2026-10-06T23:59:59Z"
  },
  "citations": [
    {
      "ref": "gap_tea_ds04",
      "type": "gap"
    },
    {
      "type": "estimator",
      "ref": "est-v1"
    },
    {
      "ref": "v1",
      "type": "policy"
    },
    {
      "type": "forecast",
      "ref": "sense_20260912_baseline_2aaad73c"
    }
  ],
  "guardrails": [
    {
      "rule": "margin_floor",
      "passed": true,
      "detail": "net margin 24.44% (net price 450.00, cost 340.00) vs premium_tea floor 12.00%"
    },
    {
      "rule": "frequency_cap",
      "passed": true,
      "detail": "all 394 customers under 2 plays in 7 days"
    },
    {
      "rule": "consent_required",
      "passed": true,
      "detail": "audience filtered by consent: 468 -> 394"
    },
    {
      "rule": "sellby_disclosure",
      "passed": true,
      "detail": "copy pending; best-before disclosure enforced at copy validation"
    },
    {
      "rule": "subscription_protect",
      "passed": true,
      "detail": "transfer_plus_nudge is not a discount play"
    },
    {
      "rule": "no_cannibalise_stockout",
      "passed": true,
      "detail": "transfer_plus_nudge does not push SKU-DARJEELING-TEA-100G; stockout rule not applicable"
    },
    {
      "rule": "holdout_required",
      "passed": true,
      "detail": "holdout 10%, min_treated_n 20"
    },
    {
      "rule": "cite_or_drop",
      "passed": true,
      "detail": "10 number(s) in rationale all cited; 4 citation(s) resolve"
    }
  ],
  "counterfactuals": {
    "do_nothing_inr": 35020.0,
    "blanket_markdown_inr": 32015.18,
    "blanket_markdown_pct": 20.0,
    "play_net_inr": -25828.71
  },
  "gap_id": "gap_tea_ds04",
  "play_id": "play_tea_ds04_v1",
  "created_at": "2026-09-12T03:30:00Z",
  "status": "proposed",
  "policy_version": "v1",
  "trace_ref": "events/run_tea_ds04_v1_ba376cf1",
  "cost": {
    "plan_cost_inr": 3.94,
    "conversation_budget_inr": 51.22,
    "pct_of_rupees_at_stake": 0.158
  },
  "source": "live_gemini"
}
