{
  "play_id": "play_529233374f_v1",
  "gap_id": "gap_529233374f",
  "tenant_id": "kutumb-mart",
  "created_at": "2026-09-12T00:00:00Z",
  "objective": "clear_online_sellby",
  "target": {
    "sku": "SKU-TONED-MILK-500ML",
    "node_ids": [
      "DS-08"
    ],
    "batch_ids": [
      "B-TONED-MILK-500ML-DS-08-01"
    ],
    "units": 86,
    "deadline_date": "2026-09-18",
    "deadline_type": "online_sellby"
  },
  "mechanic": "bundle",
  "mechanic_params": {
    "bundle_sku": "SKU-WHEAT-BREAD-400G",
    "bundle_price": 296.0
  },
  "audience": {
    "segment_ids": [
      "seg_5",
      "seg_1",
      "seg_3",
      "seg_2",
      "seg_4"
    ],
    "filters": {
      "min_affinity": 0.3
    },
    "purpose": "marketing",
    "size_before_consent": 388,
    "size_after_consent": 318
  },
  "channel": "web_chat",
  "window": {
    "start": "2026-09-12T00:00:00Z",
    "end": "2026-09-18T23:59:59Z"
  },
  "copy": {
    "language_set": [
      "en",
      "kn"
    ],
    "variants": [],
    "copy_status": "pending"
  },
  "holdout": {
    "fraction": 0.1,
    "seed": "seed-play_529233374f_v1",
    "min_treated_n": 20
  },
  "guardrails": [
    {
      "rule": "margin_floor",
      "passed": true,
      "detail": "net margin 9.57% (net price 296.00, cost 267.67) vs dairy floor 8.00%"
    },
    {
      "rule": "frequency_cap",
      "passed": true,
      "detail": "all 317 customers under 2 plays in 7 days"
    },
    {
      "rule": "consent_required",
      "passed": true,
      "detail": "audience filtered by consent: 388 -> 318"
    },
    {
      "rule": "sellby_disclosure",
      "passed": true,
      "detail": "copy pending; best-before disclosure enforced at copy validation"
    },
    {
      "rule": "subscription_protect",
      "passed": true,
      "detail": "no active subscribers of SKU-TONED-MILK-500ML in audience"
    },
    {
      "rule": "no_cannibalise_stockout",
      "passed": true,
      "detail": "no stockout gap for SKU-TONED-MILK-500ML at DS-08"
    },
    {
      "rule": "holdout_required",
      "passed": true,
      "detail": "holdout 10%, min_treated_n 20"
    },
    {
      "rule": "cite_or_drop",
      "passed": true,
      "detail": "13 number(s) in rationale all cited; 5 citation(s) resolve"
    }
  ],
  "rationale": "86 units of Toned Milk 500ML at Dark store 08 (East Bengaluru) are projected unsold before the online sell-by deadline on 2026-09-18; doing nothing writes off ₹17906 and a blanket 20% markdown costs ₹7280. This play uses a bundle with SKU-WHEAT-BREAD-400G at ₹296 for 318 consented customers (Household occasionals, Sweets regulars, Staples occasionals, Premium Tea occasionals, Personal Care occasionals): expected 21 units, margin ₹606, discount cost ₹406, waste avoided ₹4453 (CI 1 to 62 units; prior n 20, measured n 0). Policy v1: \"2. Prefer bundles and transfers over blanket markdowns; markdowns are the last lever.\"",
  "citations": [
    {
      "type": "gap",
      "ref": "gap_529233374f"
    },
    {
      "type": "estimator",
      "ref": "est-v1"
    },
    {
      "type": "policy",
      "ref": "v1"
    },
    {
      "type": "forecast",
      "ref": "sense_20260912_baseline_2aaad73c"
    },
    {
      "type": "stock",
      "ref": "B-TONED-MILK-500ML-DS-08-01"
    }
  ],
  "alternatives": [
    {
      "mechanic": "coupon",
      "mechanic_params": {
        "discount_pct": 15
      },
      "expected_units": 21.39,
      "expected_margin_inr": -180.92,
      "rejected_because": "margin_floor: net margin -4.24% (net price 199.75, cost 208.21) vs dairy floor 8.00%"
    }
  ],
  "policy_version": "v1",
  "trace_ref": "events/run_529233374f_v1_2bf3f139",
  "status": "proposed",
  "expected_outcome": {
    "units": 21.39,
    "margin_inr": 605.85,
    "waste_avoided_inr": 4452.67,
    "discount_cost_inr": 406.32,
    "ci_low": 1.15,
    "ci_high": 62.39,
    "prior_n": 20.0,
    "measured_n": 0,
    "estimator_version": "est-v1"
  },
  "counterfactuals": {
    "do_nothing_inr": 17906.06,
    "blanket_markdown_inr": 7280.05,
    "blanket_markdown_pct": 20.0
  },
  "cost": {
    "plan_cost_inr": 1.51,
    "conversation_budget_inr": 41.34,
    "pct_of_rupees_at_stake": 0.239
  }
}
